{
  "schema": 1,
  "composerPlatforms": [
    {
      "manifest": "scripts/kit/php-arginfo/5.0.0/composer.json",
      "php": "8.4.1"
    },
    {
      "manifest": "scripts/kit/php-arginfo/5.6.1/composer.json",
      "php": "8.5.0"
    }
  ],
  "pythonManifests": [],
  "pythonLocks": [],
  "npmLocks": [
    "package-lock.json",
    "tests/release-consumer/npm/package-lock.json"
  ],
  "exceptions": [
    {
      "ecosystem": "composer",
      "manifest": "scripts/kit/php-arginfo/5.0.0/composer.json",
      "package": "nikic/php-parser",
      "reason": "PHP 8.4 gen_stub.php declares PHP-Parser 5.0.0 as its paired parser release; the installer reads that declaration and requires the lock to pin the same release before it stages the generator and parser for offline use.",
      "removalCondition": "the PHP gen_stub.php source selected by .php-version declares a different PHP-Parser release; update the locked release to that declared value and verify make install-tools plus the focused K560 PHP arginfo tests",
      "verification": [
        "make install-tools",
        "node scripts/kit/run-tests.mts node -- --test-name-pattern=K560 tests/kit/php-ext.test.mts"
      ]
    },
    {
      "ecosystem": "composer",
      "manifest": "scripts/kit/php-arginfo/5.6.1/composer.json",
      "package": "nikic/php-parser",
      "reason": "PHP 8.5 gen_stub.php declares PHP-Parser 5.6.1 as its paired parser release; the installer reads that declaration and installs the lock of the same release before it stages the generator and parser for offline use.",
      "removalCondition": "the PHP gen_stub.php of a PHP that a repository declares names another PHP-Parser release; add the locked project of that release and verify make install-tools plus the focused K560 and K637 PHP arginfo tests",
      "verification": [
        "make install-tools",
        "node scripts/kit/run-tests.mts node -- --test-name-pattern=K637 tests/kit/php-ext.test.mts"
      ]
    }
  ],
  "advisoryExceptions": []
}
